{
  "status": "OPTIMAL",
  "solve_time_ms": 711,
  "objective_value": 0,
  "assignments": [
    {
      "lesson_id": "l001",
      "day": 0,
      "period": 5,
      "room_id": "r104",
      "room_name": "Room 104",
      "teacher_id": "t1",
      "group_id": "7a",
      "subject_id": "eng",
      "teacher_name": "Sarah Mitchell",
      "group_name": "Year 7A",
      "subject_name": "English"
    },
    {
      "lesson_id": "l002",
      "day": 0,
      "period": 2,
      "room_id": "r101",
      "room_name": "Room 101",
      "teacher_id": "t1",
      "group_id": "7a",
      "subject_id": "eng",
      "teacher_name": "Sarah Mitchell",
      "group_name": "Year 7A",
      "subject_name": "English"
    },
    {
      "lesson_id": "l003",
      "day": 2,
      "period": 4,
      "room_id": "sph",
      "room_name": "Sports Hall",
      "teacher_id": "t1",
      "group_id": "7a",
      "subject_id": "eng",
      "teacher_name": "Sarah Mitchell",
      "group_name": "Year 7A",
      "subject_name": "English"
    },
    {
      "lesson_id": "l004",
      "day": 0,
      "period": 6,
      "room_id": "r101",
      "room_name": "Room 101",
      "teacher_id": "t1",
      "group_id": "7a",
      "subject_id": "eng",
      "teacher_name": "Sarah Mitchell",
      "group_name": "Year 7A",
      "subject_name": "English"
    },
    {
      "lesson_id": "l005",
      "day": 1,
      "period": 1,
      "room_id": "sci1",
      "room_name": "Science Lab 1",
      "teacher_id": "t1",
      "group_id": "7a",
      "subject_id": "eng",
      "teacher_name": "Sarah Mitchell",
      "group_name": "Year 7A",
      "subject_name": "English"
    },
    {
      "lesson_id": "l006",
      "day": 0,
      "period": 3,
      "room_id": "sci1",
      "room_name": "Science Lab 1",
      "teacher_id": "t2",
      "group_id": "7a",
      "subject_id": "mat",
      "teacher_name": "Emma Davies",
      "group_name": "Year 7A",
      "subject_name": "Maths"
    },
    {
      "lesson_id": "l007",
      "day": 4,
      "period": 6,
      "room_id": "sci1",
      "room_name": "Science Lab 1",
      "teacher_id": "t2",
      "group_id": "7a",
      "subject_id": "mat",
      "teacher_name": "Emma Davies",
      "group_name": "Year 7A",
      "subject_name": "Maths"
    },
    {
      "lesson_id": "l008",
      "day": 4,
      "period": 4,
      "room_id": "sph",
      "room_name": "Sports Hall",
      "teacher_id": "t2",
      "group_id": "7a",
      "subject_id": "mat",
      "teacher_name": "Emma Davies",
      "group_name": "Year 7A",
      "subject_name": "Maths"
    },
    {
      "lesson_id": "l009",
      "day": 1,
      "period": 5,
      "room_id": "sph",
      "room_name": "Sports Hall",
      "teacher_id": "t2",
      "group_id": "7a",
      "subject_id": "mat",
      "teacher_name": "Emma Davies",
      "group_name": "Year 7A",
      "subject_name": "Maths"
    },
    {
      "lesson_id": "l010",
      "day": 3,
      "period": 6,
      "room_id": "sci1",
      "room_name": "Science Lab 1",
      "teacher_id": "t2",
      "group_id": "7a",
      "subject_id": "mat",
      "teacher_name": "Emma Davies",
      "group_name": "Year 7A",
      "subject_name": "Maths"
    },
    {
      "lesson_id": "l011",
      "day": 2,
      "period": 5,
      "room_id": "sci1",
      "room_name": "Science Lab 1",
      "teacher_id": "t3",
      "group_id": "7a",
      "subject_id": "sci",
      "teacher_name": "Rachel Green",
      "group_name": "Year 7A",
      "subject_name": "Science"
    },
    {
      "lesson_id": "l012",
      "day": 2,
      "period": 2,
      "room_id": "sci1",
      "room_name": "Science Lab 1",
      "teacher_id": "t3",
      "group_id": "7a",
      "subject_id": "sci",
      "teacher_name": "Rachel Green",
      "group_name": "Year 7A",
      "subject_name": "Science"
    },
    {
      "lesson_id": "l013",
      "day": 1,
      "period": 4,
      "room_id": "sci1",
      "room_name": "Science Lab 1",
      "teacher_id": "t3",
      "group_id": "7a",
      "subject_id": "sci",
      "teacher_name": "Rachel Green",
      "group_name": "Year 7A",
      "subject_name": "Science"
    },
    {
      "lesson_id": "l014",
      "day": 4,
      "period": 2,
      "room_id": "sci1",
      "room_name": "Science Lab 1",
      "teacher_id": "t3",
      "group_id": "7a",
      "subject_id": "sci",
      "teacher_name": "Rachel Green",
      "group_name": "Year 7A",
      "subject_name": "Science"
    },
    {
      "lesson_id": "l015",
      "day": 4,
      "period": 1,
      "room_id": "r101",
      "room_name": "Room 101",
      "teacher_id": "t4",
      "group_id": "7a",
      "subject_id": "fre",
      "teacher_name": "Philippe Dubois",
      "group_name": "Year 7A",
      "subject_name": "French"
    },
    {
      "lesson_id": "l016",
      "day": 1,
      "period": 6,
      "room_id": "r201",
      "room_name": "Room 201",
      "teacher_id": "t4",
      "group_id": "7a",
      "subject_id": "fre",
      "teacher_name": "Philippe Dubois",
      "group_name": "Year 7A",
      "subject_name": "French"
    },
    {
      "lesson_id": "l017",
      "day": 1,
      "period": 3,
      "room_id": "sph",
      "room_name": "Sports Hall",
      "teacher_id": "t4",
      "group_id": "7a",
      "subject_id": "fre",
      "teacher_name": "Philippe Dubois",
      "group_name": "Year 7A",
      "subject_name": "French"
    },
    {
      "lesson_id": "l018",
      "day": 0,
      "period": 1,
      "room_id": "r101",
      "room_name": "Room 101",
      "teacher_id": "t5",
      "group_id": "7a",
      "subject_id": "his",
      "teacher_name": "Laura Hughes",
      "group_name": "Year 7A",
      "subject_name": "History"
    },
    {
      "lesson_id": "l019",
      "day": 2,
      "period": 6,
      "room_id": "cmp1",
      "room_name": "Computer Suite 1",
      "teacher_id": "t5",
      "group_id": "7a",
      "subject_id": "his",
      "teacher_name": "Laura Hughes",
      "group_name": "Year 7A",
      "subject_name": "History"
    },
    {
      "lesson_id": "l020",
      "day": 4,
      "period": 3,
      "room_id": "sph",
      "room_name": "Sports Hall",
      "teacher_id": "t6",
      "group_id": "7a",
      "subject_id": "geo",
      "teacher_name": "Jennifer Clark",
      "group_name": "Year 7A",
      "subject_name": "Geography"
    },
    {
      "lesson_id": "l021",
      "day": 0,
      "period": 4,
      "room_id": "r102",
      "room_name": "Room 102",
      "teacher_id": "t6",
      "group_id": "7a",
      "subject_id": "geo",
      "teacher_name": "Jennifer Clark",
      "group_name": "Year 7A",
      "subject_name": "Geography"
    },
    {
      "lesson_id": "l022",
      "day": 2,
      "period": 1,
      "room_id": "sph",
      "room_name": "Sports Hall",
      "teacher_id": "t7",
      "group_id": "7a",
      "subject_id": "pe",
      "teacher_name": "Marcus Johnson",
      "group_name": "Year 7A",
      "subject_name": "PE"
    },
    {
      "lesson_id": "l023",
      "day": 4,
      "period": 5,
      "room_id": "sph",
      "room_name": "Sports Hall",
      "teacher_id": "t7",
      "group_id": "7a",
      "subject_id": "pe",
      "teacher_name": "Marcus Johnson",
      "group_name": "Year 7A",
      "subject_name": "PE"
    },
    {
      "lesson_id": "l024",
      "day": 2,
      "period": 3,
      "room_id": "cmp1",
      "room_name": "Computer Suite 1",
      "teacher_id": "t8",
      "group_id": "7a",
      "subject_id": "cmp",
      "teacher_name": "Daniel Chen",
      "group_name": "Year 7A",
      "subject_name": "Computing"
    },
    {
      "lesson_id": "l025",
      "day": 3,
      "period": 2,
      "room_id": "cmp1",
      "room_name": "Computer Suite 1",
      "teacher_id": "t8",
      "group_id": "7a",
      "subject_id": "cmp",
      "teacher_name": "Daniel Chen",
      "group_name": "Year 7A",
      "subject_name": "Computing"
    },
    {
      "lesson_id": "l026",
      "day": 3,
      "period": 6,
      "room_id": "cmp1",
      "room_name": "Computer Suite 1",
      "teacher_id": "t1",
      "group_id": "7b",
      "subject_id": "eng",
      "teacher_name": "Sarah Mitchell",
      "group_name": "Year 7B",
      "subject_name": "English"
    },
    {
      "lesson_id": "l027",
      "day": 0,
      "period": 3,
      "room_id": "r201",
      "room_name": "Room 201",
      "teacher_id": "t1",
      "group_id": "7b",
      "subject_id": "eng",
      "teacher_name": "Sarah Mitchell",
      "group_name": "Year 7B",
      "subject_name": "English"
    },
    {
      "lesson_id": "l028",
      "day": 1,
      "period": 5,
      "room_id": "r201",
      "room_name": "Room 201",
      "teacher_id": "t1",
      "group_id": "7b",
      "subject_id": "eng",
      "teacher_name": "Sarah Mitchell",
      "group_name": "Year 7B",
      "subject_name": "English"
    },
    {
      "lesson_id": "l029",
      "day": 4,
      "period": 3,
      "room_id": "r102",
      "room_name": "Room 102",
      "teacher_id": "t1",
      "group_id": "7b",
      "subject_id": "eng",
      "teacher_name": "Sarah Mitchell",
      "group_name": "Year 7B",
      "subject_name": "English"
    },
    {
      "lesson_id": "l030",
      "day": 2,
      "period": 2,
      "room_id": "r103",
      "room_name": "Room 103",
      "teacher_id": "t1",
      "group_id": "7b",
      "subject_id": "eng",
      "teacher_name": "Sarah Mitchell",
      "group_name": "Year 7B",
      "subject_name": "English"
    },
    {
      "lesson_id": "l031",
      "day": 0,
      "period": 1,
      "room_id": "r103",
      "room_name": "Room 103",
      "teacher_id": "t2",
      "group_id": "7b",
      "subject_id": "mat",
      "teacher_name": "Emma Davies",
      "group_name": "Year 7B",
      "subject_name": "Maths"
    },
    {
      "lesson_id": "l032",
      "day": 3,
      "period": 4,
      "room_id": "sph",
      "room_name": "Sports Hall",
      "teacher_id": "t2",
      "group_id": "7b",
      "subject_id": "mat",